test_id,test_strain,type,ailment_1,ailment_2,ailment_3,ailment_4,ailment_5,effects_1,effects_2,effects_3,effects_4,effects_5,effects_6,effects_7,effects_8,flavor_1,flavor_2,flavor_3,ailment_count,effects_count,flavor_count,thc_max,cbd_max,thc_cbd,cbd_thc,inventory_type,chemotype,strain_leafly_page_rank,strain_leafly_review_rank,strain_tests,strain_chemotype,strain_prop_chemotype1,strain_prop_chemotype2,strain_prop_chemotype3,strain_modal_chemo_prop
17429,Strawberry Ice,Sativa,Depression, Stress, Pain,None,None,Euphoric, Uplifted, Focused, Energetic, Happy, Dry Mouth, Paranoid,None,Strawberry, Sweet, Berry,3,7,3,63.1916,0,0,0,Hydrocarbon Wax,1,889,147,53,1,1,0,0,1
17708,ReCON,Hybrid,Stress, Insomnia, Nausea, Pain, Lack of Appetite,Relaxed, Hungry, Sleepy, Happy, Euphoric, Dry Mouth, Anxious, Paranoid,Sweet,None,None,5,8,1,19.2678,0.1,192.68,0.01,Flower Lot,1,762,142,10,1,1,0,0,1
17750,P-51,Indica,Pain, Insomnia, Nausea, Stress,None,Happy, Tingly, Uplifted, Relaxed, Dry Mouth, Paranoid,None,None,Earthy, Sweet,None,4,6,2,24.90322,0.22,113.2,0.01,Flower Lot,1,1673,151,117,1,1,0,0,1
17932,Conspiracy Kush,Hybrid,Pain, Lack of Appetite, Stress, Insomnia, Inflammation,Relaxed, Happy, Euphoric, Sleepy, Creative, Dry Mouth, Anxious,None,Earthy, Sweet, Berry,5,7,3,21.26,0.45,47.24,0.02,Flower Lot,1,655,129,95,1,1,0,0,1
17962,Silver Haze,Hybrid,Stress, Depression, Lack of Appetite, Pain, Insomnia,Euphoric, Happy, Energetic, Uplifted, Relaxed, Dry Mouth, Paranoid, Anxious,Earthy, Sweet,None,5,8,2,16.2736,0.33,49.31,0.02,Flower Lot,1,90,82,141,1,1,0,0,1
18075,Mad Scientist,Hybrid,Insomnia, Pain, Stress, Depression, Muscle Spasms,Relaxed, Euphoric, Uplifted, Focused, Sleepy, Dry Mouth, Paranoid,None,Earthy, Pine,None,5,7,2,20.36405,0,0,0,Flower Lot,1,1067,152,10,1,1,0,0,1
18265,Space Candy,Hybrid,None,None,None,None,None,None,None,None,None,None,None,None,None,Citrus,Sweet,Pine,0,0,3,21.72,0.11,197.45,0.01,Flower Lot,1,425,138,174,1,1,0,0,1
18335,Lemonberry,Hybrid,None,None,None,None,None,Euphoric,Energetic,Giggly,Happy,Creative,None,None,None,None,None,None,0,5,0,15.1913,0.24,63.3,0.02,Flower Lot,1,651,145,73,1,1,0,0,1
18787,Stephen Hawking Kush,Hybrid,Stress, Pain, Nausea, Depression,None,Relaxed, Happy, Euphoric, Focused, Uplifted, Dry Mouth, Paranoid,None,Earthy, Pine,None,4,7,2,21.31,0.14,152.21,0.01,Flower Lot,1,548,147,122,2,0.2213115,0.7786885,0,0.7786885
18789,Purple Punch,Hybrid,Stress, Depression, Pain, Inflammation, Muscle Spasms,Relaxed, Happy, Euphoric, Uplifted, Sleepy, Dry Mouth,None,None,Sweet, Berry, Grape,5,6,3,4.2,15.03,0.28,3.58,Flower Lot,2,228,109,25,1,0.96,0.04,0,0.96
18822,Webster,Hybrid,Pain, Stress, Inflammation,None,None,Relaxed, Sleepy, Talkative, Uplifted, Happy,None,None,None,Citrus, Sweet,None,3,5,2,24.3,0.5,48.6,0.02,Flower Lot,1,1743,151,1,1,1,0,0,1
18903,Purple Champagne,Hybrid,Stress, Pain, Depression,None,None,Uplifted, Focused, Creative, Euphoric, Happy, Dry Mouth,None,None,Grape, Earthy,None,3,6,2,25.75,0.38,67.76,0.01,Flower Lot,1,927,139,164,1,1,0,0,1
19057,Tang,Hybrid,None,None,None,None,None,None,None,None,None,None,None,None,None,Citrus,Orange,Sweet,0,0,3,17.5584,0.42,41.81,0.02,Flower Lot,1,0,0,0,0,0,0,0,0
19170,Strawberry Blue,Hybrid,Stress, Depression, Pain, Lack of Appetite,None,Happy, Energetic, Uplifted, Euphoric, Dry Mouth,None,None,None,Strawberry, Sweet, Berry,4,5,3,15.1613,0.12,126.34,0.01,Flower Lot,1,748,145,105,1,0.9809524,0,0.0190476,0.9809524
19386,Snow Monster,Indica,Pain, Insomnia, Stress, Lack of Appetite,None,Relaxed, Happy, Hungry, Uplifted, Euphoric, Dry Mouth,None,None,Sweet, Earthy, Skunk,4,6,3,13.0534,0.07,186.48,0.01,Flower Lot,1,1287,146,46,1,1,0,0,1
19832,Locktite,Hybrid,None,None,None,None,None,Relaxed,Happy,Uplifted,Tingly,Euphoric,None,None,None,Sweet,Citrus,Earthy,0,5,3,22.2527,0.12,185.44,0.01,Flower Lot,1,625,132,356,1,0.988764,0.005618,0.005618,0.988764
19970,Allen Wrench,Hybrid,Stress, Depression, Pain, Lack of Appetite,None,Energetic, Happy, Focused, Uplifted, Creative, Dry Mouth, Anxious,None,Earthy, Pine, Citrus,4,7,3,15.4,0.2,77,0.01,Flower Lot,1,380,123,551,1,0.9981851,0.0018149,0,0.9981851
20108,Tangerine Kush,Hybrid,Insomnia, Stress, Pain, Depression, Lack of Appetite,Relaxed, Sleepy, Happy, Euphoric, Uplifted, Dry Mouth, Paranoid, Anxious,Citrus, Orange, Sweet,5,8,3,17.7992,0.15,118.66,0.01,Flower Lot,1,267,113,37,1,1,0,0,1
20497,Hawaiian Punch,Hybrid,Pain, Stress,None,None,None,Happy, Uplifted, Relaxed, Euphoric, Tingly, Anxious, Dry Mouth, Paranoid,Citrus, Sweet,None,2,8,2,19.98,0.69,28.96,0.03,Flower Lot,1,784,145,239,1,0.9958159,0.0041841,0,0.9958159
20552,Gobbstopper,Hybrid,Depression, Nausea, Stress, Insomnia,None,Happy, Relaxed, Euphoric, Horny, Sleepy, Dry Mouth,None,None,Sweet, Berry,None,4,6,2,15.8906,0.12,132.42,0.01,Flower Lot,1,1567,151,118,1,1,0,0,1
20634,Mendo Purps,Hybrid,None,None,None,None,None,None,None,None,None,None,None,None,None,Earthy,Pine,Woody,0,0,3,14.582,0.15,97.21,0.01,Flower Lot,1,160,123,281,1,0.9893239,0.0035587,0.0071174,0.9893239
20818,Training Day,Hybrid,Insomnia, Pain, Stress, Depression, Muscle Spasms,Relaxed, Euphoric, Sleepy, Happy, Hungry, Dry Mouth, Anxious,None,Earthy, Pine,None,5,7,2,17.4,0.3,58,0.02,Flower Lot,1,773,142,380,1,1,0,0,1
21220,Hog's Breath,Hybrid,None,None,None,None,None,None,None,None,None,None,None,None,None,Earthy,Lemon,Flowery,0,0,3,18.2,0.4,45.5,0.02,Flower Lot,1,664,140,42,1,1,0,0,1
21440,Sour Amnesia,Hybrid,Stress, Depression, Pain, Inflammation,None,Happy, Uplifted, Euphoric, Energetic, Relaxed, Dry Mouth, Anxious, Paranoid,Sweet, Earthy,None,4,8,2,24.8,0.2,124,0.01,Flower Lot,1,603,137,35,1,0.8857143,0,0.1142857,0.8857143
21726,Hindu Skunk,Hybrid,Stress, Pain, Insomnia, Depression, Nausea,Relaxed, Happy, Euphoric, Sleepy, Hungry, Dry Mouth, Paranoid,None,Skunk, Earthy, Sweet,5,7,3,16.27461,0,0,0,Flower Lot,1,843,148,19,1,1,0,0,1
21729,Kryptonite,Hybrid,Pain, Stress, Insomnia, Depression,None,Relaxed, Happy, Tingly, Uplifted, Euphoric, Dry Mouth, Paranoid, Anxious,Sweet, Earthy, Pine,4,8,3,18.30326,0.09,203.37,0,Flower Lot,1,240,115,114,1,0.877193,0.122807,0,0.877193
21733,Kush Dream,Hybrid,None,None,None,None,None,None,None,None,None,None,None,None,None,Flowery,Sweet,Citrus,0,0,3,15.1651,0.07,216.64,0,Flower Lot,1,0,0,0,0,0,0,0,0
21738,Mango,Hybrid,Stress, Pain, Depression, Insomnia, Lack of Appetite,Relaxed, Euphoric, Happy, Sleepy, Hungry, Dry Mouth, Paranoid, Anxious,Mango, Sweet,None,5,8,2,19.21224,0.16,120.08,0.01,Flower Lot,1,173,119,223,1,1,0,0,1
21777,Grapefruit Haze,Hybrid,Stress, Depression, Pain, Muscle Spasms,None,Uplifted, Happy, Euphoric, Relaxed, Talkative, Dry Mouth, Paranoid, Anxious,Lemon, Citrus,None,4,8,2,20.6,0.2,103,0.01,Flower Lot,1,900,141,6,1,1,0,0,1
22467,Dog Walker,Hybrid,None,None,None,None,None,None,None,None,None,None,None,None,None,Tropical,Orange,Sweet,0,0,3,21.65539,0.19,113.98,0.01,Flower Lot,1,279,123,102,1,1,0,0,1
22562,Grape Crush,Indica,Stress, Pain, Depression, Muscle Spasms, Insomnia,Relaxed, Euphoric, Happy, Uplifted, Creative, Dry Mouth,None,None,Grape, Sweet, Berry,5,6,3,22.24,0.06,370.67,0,Flower Lot,1,770,146,4,1,1,0,0,1
22618,Solace,Hybrid,None,None,None,None,None,None,None,None,None,None,None,None,None,Berry,Earthy,Sweet,0,0,3,15.5967,0.5,31.19,0.03,Flower Lot,1,0,0,0,0,0,0,0,0
22651,Woody Kush,Hybrid,Insomnia, Stress, Depression, Pain, Lack of Appetite,Relaxed, Happy, Euphoric, Sleepy, Hungry, Dry Mouth, Paranoid,None,Pine, Earthy,None,5,7,2,23.2373,4.9,4.74,0.21,Flower Lot,2,982,147,18,1,0.9444444,0.0555556,0,0.9444444
23046,Bubblegum Kush,Hybrid,Pain, Stress, Inflammation, Lack of Appetite, Muscle Spasms,Relaxed, Happy, Focused, Euphoric, Uplifted, Dry Mouth, Anxious, Paranoid,Sweet, Earthy, Citrus,5,8,3,15.0828,0.3,50.28,0.02,Flower Lot,1,163,113,64,1,1,0,0,1
23526,Ice Bomb,Hybrid,None,None,None,None,None,None,None,None,None,None,None,None,None,Sweet,Earthy,Pungent,0,0,3,16.7614,0.5,33.52,0.03,Flower Lot,1,0,0,0,0,0,0,0,0
23751,SFV OG Kush,Indica,Pain, Muscle Spasms, Inflammation, Insomnia, Depression,Relaxed, Happy, Hungry, Sleepy, Uplifted, Dry Mouth, Paranoid,None,Earthy, Citrus, Sweet,5,7,3,22.16,0.06,369.33,0,Flower Lot,1,212,137,24,1,1,0,0,1
62066,Hurkle,Hybrid,None,None,None,None,None,Relaxed,Happy,Hungry,Focused,Sleepy,None,None,None,None,None,None,0,5,0,14.2066,0.06,236.78,0,Flower Lot,1,865,140,86,1,0.627907,0.372093,0,0.627907
23936,Sage N Sour,Sativa,Depression, Stress, Pain,None,None,Happy, Focused, Relaxed, Uplifted, Euphoric, Dry Mouth, Paranoid, Anxious,Earthy,None,None,3,8,1,16.3268,0,0,0,Flower Lot,1,423,134,147,1,0.9659864,0.0136054,0.0204082,0.9659864
24168,Heisenberg Kush,Sativa,Depression, Stress, Pain,None,None,Happy, Euphoric, Energetic, Uplifted, Creative, Dry Mouth,None,None,Berry, Sweet, Grape,3,6,3,15.6544,0.08,195.68,0.01,Flower Lot,1,886,149,25,1,1,0,0,1
24307,Swiss Tsunami,Sativa,Pain, Depression, Inflammation, Stress,None,Relaxed, Happy, Uplifted, Focused, Sleepy, Dry Mouth,None,None,Citrus, Orange, Earthy,4,6,3,1,16.58,0.06,16.58,Flower Lot,3,1185,146,16,3,0.3125,0.1875,0.5,0.5
24383,Jack Diesel,Hybrid,Depression, Inflammation, Stress, Pain,None,Happy, Energetic, Creative, Uplifted, Dry Mouth, Paranoid,None,None,Sweet, Citrus,None,4,6,2,15.532,0.6,25.89,0.04,Flower Lot,1,997,147,113,1,1,0,0,1
25091,Cat Piss,Hybrid,Stress, Depression, Pain, Lack of Appetite,None,Happy, Energetic, Creative, Uplifted, Euphoric, Dry Mouth, Paranoid, Anxious,Ammonia, Earthy,None,4,8,2,14.2812,0.5,28.56,0.04,Flower Lot,1,200,120,4,1,1,0,0,1
25246,U2 Kush,Hybrid,Depression, Insomnia, Stress, Pain,None,Relaxed, Sleepy, Happy, Hungry, Uplifted, Dry Mouth, Anxious,None,Sweet,None,None,4,7,1,23.65,0.1,236.5,0,Flower Lot,1,1444,149,30,1,1,0,0,1
25636,Blue Ox,Hybrid,Depression, Lack of Appetite, Pain,None,None,Sleepy, Relaxed, Talkative, Uplifted, Euphoric,None,None,None,Berry, Blueberry,None,3,5,2,23.59879,0.09,262.21,0,Flower Lot,1,1609,152,29,1,0.9310345,0.0689655,0,0.9310345
25768,White Berry,Hybrid,Insomnia, Stress, Depression, Pain,None,Horny, Euphoric, Happy, Creative, Focused, Paranoid, Anxious, Dry Mouth,Berry, Sweet, Earthy,4,8,3,21.86,0.41,53.32,0.02,Flower Lot,1,346,135,31,1,1,0,0,1
25769,StarDawg,Hybrid,None,None,None,None,None,Happy,Relaxed,Uplifted,Euphoric,Talkative,None,None,None,None,None,None,0,5,0,23.16,0.29,79.86,0.01,Flower Lot,1,75,70,302,1,1,0,0,1
25896,OG-18,Indica,None,None,None,None,None,Relaxed,Sleepy,Happy,Hungry,Euphoric,None,None,None,None,None,None,0,5,0,23.0143,0.1,230.14,0,Flower Lot,1,174,103,31,1,1,0,0,1
26056,Money Maker,Hybrid,Pain, Insomnia, Muscle Spasms, Depression, Lack of Appetite,Relaxed, Sleepy, Happy, Hungry, Uplifted, Dry Mouth, Paranoid,None,Earthy, Berry, Skunk,5,7,3,18.1539,0,0,0,Flower Lot,1,467,148,1,1,1,0,0,1
26505,Harle-Tsu,Hybrid,None,None,None,None,None,Relaxed,Happy,Uplifted,Focused,Euphoric,None,None,None,Earthy,Citrus,Sweet,0,5,3,5.27628,10,0.53,1.9,Flower Lot,2,219,103,186,3,0.2043011,0.3602151,0.4354839,0.4354839
26528,Willy Wonka,Hybrid,Stress, Depression, Pain,None,None,Happy, Talkative, Energetic, Euphoric, Uplifted, Dry Mouth, Paranoid,None,Sweet, Mint, Pine,3,7,3,15.1582,0.1,151.58,0.01,Flower Lot,1,798,147,21,1,1,0,0,1
27013,Somango,Indica,Pain, Stress, Insomnia, Lack of Appetite, Depression,Relaxed, Happy, Uplifted, Focused, Sleepy, Dry Mouth, Paranoid,None,Mango, Earthy, Sweet,5,7,3,15.75092,2.41,6.54,0.15,Flower Lot,1,417,130,27,1,1,0,0,1
27139,Danky Doodle,Indica,Stress, Pain, Depression, Insomnia, Nausea,Euphoric, Happy, Uplifted, Horny, Energetic, Dry Mouth, Paranoid,None,Sweet, Skunk,None,5,7,2,13.2427,0,0,0,Flower Lot,1,0,0,0,0,0,0,0,0
27563,Dr. Grinspoon,Sativa,Depression, Stress, Pain,None,None,Energetic, Euphoric, Uplifted, Happy, Creative, Dry Mouth, Paranoid,None,Citrus, Earthy,None,3,7,2,26.16,0.07,373.71,0,Flower Lot,1,420,149,2,1,1,0,0,1
27657,Purple Dream,Hybrid,None,None,None,None,None,None,None,None,None,None,None,None,None,Earthy,Blueberry,Pungent,0,0,3,16.17969,0,0,0,Flower Lot,1,272,116,23,1,1,0,0,1
27756,Mango Haze,Hybrid,Stress, Depression, Pain, Lack of Appetite,None,Happy, Uplifted, Relaxed, Euphoric, Energetic, Dry Mouth, Anxious,None,Mango, Sweet,None,4,7,2,23.25,0.07,332.14,0,Flower Lot,1,197,110,177,1,0.9152542,0.0847458,0,0.9152542
28464,Kona Gold,Hybrid,Depression, Stress, Nausea, Pain,None,Happy, Energetic, Uplifted, Creative, Euphoric, Dry Mouth, Anxious, Paranoid,Sweet, Honey,None,4,8,2,23.34,0.17,137.29,0.01,Flower Lot,1,972,150,29,1,1,0,0,1
28926,Sour Dream,Hybrid,None,None,None,None,None,None,None,None,None,None,None,None,None,Sweet,Flowery,Pepper,0,0,3,17.36364,0,0,0,Flower Lot,1,430,142,18,1,1,0,0,1
29270,Silver Kush,Hybrid,Stress, Depression, Pain, Lack of Appetite, Muscle Spasms,Relaxed, Happy, Uplifted, Creative, Talkative, Dry Mouth, Paranoid,None,Earthy, Citrus,None,5,7,2,48.1764,0.18,267.65,0,Hydrocarbon Wax,1,389,137,31,1,1,0,0,1
29544,Strawberry Banana,Hybrid,None,None,None,None,None,None,None,None,None,None,None,None,None,Woody,Earthy,Grapefruit,0,0,3,16.0752,0.12,133.96,0.01,Flower Lot,1,130,99,193,1,1,0,0,1
29685,Hurricane,Sativa,Stress, Pain, Nausea, Depression,None,Euphoric, Happy, Relaxed, Energetic, Uplifted, Dry Mouth, Anxious,None,Sweet, Grape,None,4,7,2,18.3677,0.15,122.45,0.01,Flower Lot,1,1155,145,29,1,1,0,0,1
29911,Ghost OG,Hybrid,None,None,None,None,None,None,None,None,None,None,None,None,None,Sweet,Citrus,Orange,0,0,3,23.3,0.3,77.67,0.01,Flower Lot,1,95,96,191,1,0.9790576,0.0209424,0,0.9790576
30026,Sour Alien,Hybrid,None,None,None,None,None,None,None,None,None,None,None,None,None,Earthy,Citrus,Flowery,0,0,3,19.42,0.16,121.38,0.01,Flower Lot,1,620,134,6,1,1,0,0,1
30211,Walrus Kush,Hybrid,None,None,None,None,None,None,None,None,None,None,None,None,None,Earthy,Flowery,Lime,0,0,3,17.41,0.34,51.21,0.02,Flower Lot,1,1889,152,2,1,1,0,0,1
30260,Honey Boo Boo,Indica,Pain, Stress, Depression, Lack of Appetite,None,Relaxed, Sleepy, Euphoric, Tingly, Uplifted, Dry Mouth, Anxious,None,Honey, Citrus, Lemon,4,7,3,18.06,0.17,106.24,0.01,Flower Lot,1,796,149,21,1,1,0,0,1
30261,J1,Hybrid,None,None,None,None,None,Euphoric,Happy,Creative,Uplifted,Energetic,None,None,None,None,None,None,0,5,0,20.9325,0.27,77.53,0.01,Flower Lot,1,152,93,167,1,1,0,0,1
30434,Strawberry Frost,Indica,Depression, Stress, Lack of Appetite,None,None,Happy, Horny, Relaxed, Hungry, Dry Mouth,None,None,None,Sweet, Strawberry, Earthy,3,5,3,17.8154,0.2,89.08,0.01,Flower Lot,1,956,148,52,1,1,0,0,1
32660,California Hash Plant,Indica,Stress,None,None,None,None,Sleepy, Hungry, Relaxed,None,None,None,None,None,Citrus,None,None,1,3,1,8.2807,0,0,0,Flower Lot,1,1447,150,17,1,1,0,0,1
32694,MediHaze,Sativa,Pain, Stress, Depression, Inflammation, Nausea,Happy, Focused, Uplifted, Relaxed, Energetic, Anxious, Dry Mouth, Paranoid,Pine, Earthy, Citrus,5,8,3,9.25187,11.96,0.77,1.29,Flower Lot,2,456,119,91,2,0.0659341,0.9120879,0.021978,0.9120879
32756,Yoda OG,Hybrid,Stress, Pain, Insomnia, Depression,None,Relaxed, Sleepy, Euphoric, Hungry, Happy, Anxious, Dry Mouth,None,Earthy,None,None,4,7,1,20.19,0.4,50.48,0.02,Flower Lot,1,249,114,33,1,1,0,0,1
33071,Atomic,Hybrid,None,None,None,None,None,Happy,Relaxed,Talkative,Creative,Euphoric,None,None,None,None,None,None,0,5,0,22.6,0.4,56.5,0.02,Flower Lot,1,0,0,0,0,0,0,0,0
34012,Dutch Haze,Hybrid,None,None,None,None,None,Energetic, Creative, Happy, Horny, Uplifted,None,None,None,Citrus, Earthy,None,0,5,2,16.22878,0.28,57.96,0.02,Flower Lot,1,1083,149,64,1,1,0,0,1
34039,Crystal,Hybrid,None,None,None,None,None,None,None,None,None,None,None,None,None,Earthy,Woody,Pungent,0,0,3,16.7605,0.08,209.51,0,Flower Lot,1,0,0,0,0,0,0,0,0
34240,Mindbender,Hybrid,None,None,None,None,None,None,None,None,None,None,None,None,None,Earthy,Sweet,Sage,0,0,3,14.9366,0.18,82.98,0.01,Flower Lot,1,0,0,0,0,0,0,0,0
34382,Euphoria,Hybrid,None,None,None,None,None,Euphoric,Happy,Energetic,Creative,Relaxed,None,None,None,None,None,None,0,5,0,7.98129,0.14,57.01,0.02,Flower Lot,1,368,140,20,1,0.8,0.2,0,0.8
34420,Phantom OG,Indica,Depression, Pain, Insomnia, Lack of Appetite,None,Euphoric, Relaxed, Hungry, Happy, Focused, Dry Mouth, Paranoid, Anxious,Earthy, Lemon,None,4,8,2,26.64,0.01,2664,0,Flower Lot,1,469,142,33,1,1,0,0,1
34579,Lemon Thai,Hybrid,Stress, Pain, Depression, Lack of Appetite,None,Happy, Talkative, Relaxed, Sleepy, Uplifted, Dry Mouth, Anxious, Paranoid,Lemon, Sweet,None,4,8,2,81.49474,0.57,142.97,0.01,CO2 Hash Oil,1,405,142,7,1,1,0,0,1
34612,91 Krypt,Indica,Stress, Depression, Lack of Appetite, Nausea,None,Relaxed, Tingly, Happy, Hungry, Talkative, Dry Mouth,None,None,Earthy, Sweet,None,4,6,2,12.1641,0.2,60.82,0.02,Flower Lot,1,1216,151,55,1,1,0,0,1
34788,Full Moon,Hybrid,Depression, Stress, Lack of Appetite,None,None,Happy, Energetic, Uplifted, Horny, Creative,None,None,None,Ammonia,None,None,3,5,1,21.1464,0.3,70.49,0.01,Flower Lot,1,791,150,30,1,1,0,0,1
34850,Caramelo,Hybrid,Stress, Pain, Depression, Lack of Appetite,None,Happy, Euphoric, Energetic, Focused, Uplifted, Dry Mouth,None,None,Sweet, Lavender,None,4,6,2,18.513,0.12,154.28,0.01,Flower Lot,1,1086,150,14,1,1,0,0,1
35041,Northern Light,Hybrid,None,None,None,None,None,None,None,None,None,None,None,None,None,Lemon,Citrus,Pungent,0,0,3,14.5582,1.4,10.4,0.1,Flower Lot,1,11,11,1389,1,0.987761,0.0115191,0.0007199,0.987761
35413,Afghani Bullrider,Hybrid,Stress, Depression, Insomnia, Pain,None,Uplifted, Relaxed, Happy, Euphoric, Dry Mouth, Paranoid,None,None,Sweet, Pine, Earthy,4,6,3,20.417,0,0,0,Flower Lot,1,585,139,18,1,1,0,0,1
35424,Memory Loss,Hybrid,Stress, Depression, Pain, Nausea,None,Uplifted, Happy, Talkative, Focused, Creative, Dry Mouth, Anxious,None,Earthy, Sweet,None,4,7,2,21.25,0.3,70.83,0.01,Flower Lot,1,671,144,123,1,0.9593496,0.0406504,0,0.9593496
35885,Sour Cookies,Hybrid,None,None,None,None,None,None,None,None,None,None,None,None,None,Sweet,Berry,Blueberry,0,0,3,20.4525,0.11,185.93,0.01,Flower Lot,1,300,130,62,1,1,0,0,1
36105,Trash,Hybrid,None,None,None,None,None,Relaxed,Happy,Uplifted,Euphoric,Focused,None,None,None,None,None,None,0,5,0,24.1667,0.2,120.83,0.01,Flower Lot,1,1287,149,147,1,1,0,0,1
36132,Punky Lion,Hybrid,Stress, Depression, Muscle Spasms, Pain,None,Relaxed, Sleepy, Hungry, Euphoric, Tingly, Paranoid, Dry Mouth,None,Earthy, Sweet,None,4,7,2,19.81,0.09,220.11,0,Flower Lot,1,0,0,0,0,0,0,0,0
36199,Dinachem,Hybrid,None,None,None,None,None,Talkative,Relaxed,Happy,Energetic,Giggly,None,None,None,None,None,None,0,5,0,24.89,0.09,276.56,0,Flower Lot,1,1337,147,25,1,1,0,0,1
36429,Sweet Black Angel,Hybrid,Depression, Stress, Pain, Insomnia,None,Relaxed, Sleepy, Happy, Euphoric, Uplifted, Dry Mouth,None,None,Sweet, Berry, Pine,4,6,3,17.7,0.2,88.5,0.01,Flower Lot,1,1030,144,33,1,1,0,0,1
36432,Fruity Chronic Juice,Hybrid,Lack of Appetite, Pain, Stress, Depression,None,Relaxed, Euphoric, Happy, Talkative, Creative, Dry Mouth, Anxious,None,Citrus, Sweet,None,4,7,2,18,0.3,60,0.02,Flower Lot,1,901,150,45,1,1,0,0,1
36459,Chocolate Fondue,Hybrid,Depression, Stress, Nausea, Lack of Appetite,None,Relaxed, Uplifted, Happy, Talkative, Euphoric, Dry Mouth, Anxious,None,Sweet, Earthy,None,4,7,2,19.4,0.2,97,0.01,Flower Lot,1,1009,146,1,1,1,0,0,1
36493,Buddha Tahoe,Hybrid,Insomnia, Pain, Stress, Depression,None,Relaxed, Happy, Euphoric, Sleepy, Uplifted, Dry Mouth, Anxious,None,Earthy,None,None,4,7,1,19.8,0.2,99,0.01,Flower Lot,1,584,142,89,1,1,0,0,1
36598,Destroyer,Hybrid,Depression, Stress, Insomnia,None,None,Energetic, Uplifted, Euphoric, Happy,None,None,None,None,Lavender, Ammonia, Sweet,3,4,3,15.5944,0.32,48.73,0.02,Flower Lot,1,737,141,10,1,1,0,0,1
36700,Citrix,Hybrid,None,None,None,None,None,Happy,Euphoric,Uplifted,Relaxed,Energetic,None,None,None,None,None,None,0,5,0,21.56,0.04,539,0,Flower Lot,1,743,144,13,1,1,0,0,1
37410,Nebula,Hybrid,None,None,None,None,None,Uplifted,Happy,Euphoric,Energetic,Creative,None,None,None,None,None,None,0,5,0,14,0.1,140,0.01,Flower Lot,1,292,130,1,1,1,0,0,1
37608,Sunset Sherbet,Sativa,None,None,None,None,None,None,None,None,None,None,None,None,None,Sweet,Flowery,Citrus,0,0,3,17.8269,0.11,162.06,0.01,Flower Lot,1,24,28,814,1,1,0,0,1
37761,Church OG,Hybrid,Stress, Depression, Pain, Insomnia,None,Relaxed, Happy, Uplifted, Creative, Horny, Dry Mouth, Paranoid,None,Earthy, Citrus,None,4,7,2,64.3658,0.39,165.04,0.01,Hydrocarbon Wax,1,574,145,44,1,1,0,0,1
37798,Hawaiian Snow,Hybrid,Depression, Pain, Stress,None,None,Happy, Relaxed, Uplifted, Euphoric, Creative, Dry Mouth, Anxious, Paranoid,None,None,None,3,8,0,19.1893,0.09,213.21,0,Flower Lot,1,313,135,24,1,1,0,0,1
38005,Star Killer,Hybrid,Pain, Stress, Insomnia, Depression, Nausea,Relaxed, Euphoric, Sleepy, Happy, Hungry, Dry Mouth, Paranoid, Anxious,Lemon, Earthy,None,5,8,2,19.88261,0.13,152.94,0.01,Flower Lot,1,287,105,28,1,1,0,0,1
38103,Enemy of the State,Indica,Stress, Depression, Insomnia, Lack of Appetite,None,Relaxed, Focused, Sleepy, Horny, Euphoric, Anxious, Dry Mouth, Paranoid,Sweet, Berry,None,4,8,2,19.694,0.2,98.47,0.01,Flower Lot,1,1026,142,82,1,1,0,0,1
38144,Dawgfather,Hybrid,None,None,None,None,None,None,None,None,None,None,None,None,None,Earthy,Woody,Spicy/Herbal,0,0,3,10.26967,0,0,0,Flower Lot,1,1804,152,35,1,1,0,0,1
38927,Dutch Queen,Hybrid,None,None,None,None,None,None,None,None,None,None,None,None,None,Earthy,Citrus,Flowery,0,0,3,26.99,0.07,385.57,0,Flower Lot,1,1734,150,46,1,1,0,0,1
39015,Future,Hybrid,None,None,None,None,None,Relaxed,Euphoric,Uplifted,Sleepy,Happy,None,None,None,None,None,None,0,5,1,22.53,0.15,150.2,0.01,Flower Lot,1,977,141,37,1,1,0,0,1
40325,Cornbread,Hybrid,Stress, Lack of Appetite, Pain, Insomnia,None,Relaxed, Hungry, Happy, Sleepy, Euphoric, Dry Mouth, Paranoid,None,Earthy, Citrus,None,4,7,2,15.90814,0.13,122.37,0.01,Flower Lot,1,531,121,34,1,1,0,0,1
40351,Durban Cookies,Hybrid,Pain, Stress, Depression, Inflammation,None,Happy, Relaxed, Uplifted, Talkative, Energetic, Dry Mouth, Paranoid, Anxious,Sweet, Earthy,None,4,8,2,18.95,0.1,189.5,0.01,Flower Lot,1,799,133,76,1,1,0,0,1
40446,Swiss Tsu 2,Hybrid,None,None,None,None,None,None,None,None,None,None,None,None,None,Lemon,Sweet,Blueberry,0,0,3,3.94,73.05,0.05,18.54,Food Grade Solvent Extract,3,0,0,0,0,0,0,0,0
40703,Magnum,Hybrid,None,None,None,None,None,Energetic,Happy,Creative,Uplifted,Euphoric,None,None,None,None,None,None,0,5,0,10.7978,0.05,215.96,0,Flower Lot,1,859,148,12,1,1,0,0,1
40760,White Nightmare,Hybrid,Stress, Pain, Depression, Lack of Appetite, Inflammation,Uplifted, Euphoric, Happy, Creative, Energetic, Dry Mouth, Anxious, Paranoid,Earthy, Sweet, Citrus,5,8,3,15.786,0.61,25.88,0.04,Flower Lot,1,539,141,144,1,1,0,0,1
40827,Willie Nelson,Hybrid,Stress, Depression, Pain, Nausea,None,Happy, Euphoric, Creative, Energetic, Uplifted, Dry Mouth, Paranoid, Anxious,Earthy, Sweet,None,4,8,2,7.8,0.1,78,0.01,Flower Lot,1,358,136,96,1,1,0,0,1
40877,Mataro Blue,Hybrid,Pain, Stress, Depression, Insomnia, Muscle Spasms,Relaxed, Euphoric, Hungry, Happy, Tingly, Dry Mouth,None,None,Berry, Earthy, Sweet,5,6,3,20.29,0.06,338.17,0,Flower Lot,1,819,141,7,1,0.7142857,0.2857143,0,0.7142857
40917,Hades Haze,Indica,Insomnia, Depression, Lack of Appetite, Pain,None,Relaxed, Sleepy, Talkative, Euphoric,None,None,None,None,Citrus, Earthy,None,4,4,2,11.6748,0.05,233.5,0,Flower Lot,1,1749,149,112,1,1,0,0,1
41093,Purple Star,Hybrid,Pain, Insomnia, Depression, Muscle Spasms,None,Tingly, Sleepy, Hungry, Relaxed, Uplifted, Dry Mouth, Anxious,None,Berry, Citrus, Pine,4,7,3,17.9569,0.65,27.63,0.04,Flower Lot,1,1242,149,22,1,1,0,0,1
42509,PowerNap,Hybrid,None,None,None,None,None,None,None,None,None,None,None,None,None,Diesel,Citrus,Woody,0,0,3,20.6132,0.11,187.39,0.01,Flower Lot,1,0,0,0,0,0,0,0,0
42515,Tangie,Hybrid,Stress, Depression, Pain, Lack of Appetite,None,Happy, Uplifted, Energetic, Euphoric, Relaxed, Dry Mouth, Anxious, Paranoid,Citrus, Orange, Sweet,4,8,3,72.4905,0.61,118.84,0.01,Hydrocarbon Wax,1,38,34,759,1,0.9947299,0.002635,0.002635,0.9947299
42522,Cherries Jubilee,Indica,Stress, Depression, Pain, Nausea,None,Euphoric, Relaxed, Uplifted, Happy, Horny, Dry Mouth,None,None,Berry, Sweet,None,4,6,2,69,4.9,14.08,0.07,CO2 Hash Oil,1,1607,150,551,1,0.9836661,0.0108893,0.0054446,0.9836661
43710,Monolith,Indica,Insomnia, Lack of Appetite, Pain, Stress, Depression,Relaxed, Sleepy, Tingly, Euphoric, Focused,None,None,None,Earthy, Pine,None,5,5,2,24.93,0.04,623.25,0,Flower Lot,1,1844,148,68,1,1,0,0,1
43955,Black Domina,Hybrid,Stress, Depression, Pain, Insomnia, Lack of Appetite,Relaxed, Sleepy, Euphoric, Happy, Uplifted, Dry Mouth, Paranoid,None,Pine, Pepper,None,5,7,2,15.74873,0,0,0,Flower Lot,1,176,121,108,1,0.962963,0.037037,0,0.962963
44186,Starfighter,Hybrid,None,None,None,None,None,Euphoric,Relaxed,Happy,Uplifted,Creative,None,None,None,None,None,None,0,5,0,77.28,0.38,203.37,0,Hydrocarbon Wax,1,399,148,45,1,1,0,0,1
45542,Blue Diamond,Hybrid,Stress, Depression, Pain,None,None,Euphoric, Relaxed, Happy, Uplifted, Sleepy, Paranoid, Dry Mouth, Anxious,Sweet, Earthy,None,3,8,2,21.9157,0.11,199.23,0.01,Flower Lot,1,428,143,13,1,1,0,0,1
45871,Lime Skunk,Hybrid,Depression, Stress, Pain, Muscle Spasms,None,Uplifted, Creative, Relaxed, Happy, Euphoric, Dry Mouth, Anxious,None,Lime, Citrus, Lemon,4,7,3,24.6789,0.25,98.72,0.01,Flower Lot,1,716,125,62,1,1,0,0,1
46201,Night Nurse,Hybrid,Pain, Insomnia, Stress, Muscle Spasms,None,Relaxed, Sleepy, Happy, Tingly, Hungry, Dry Mouth,None,None,Sweet, Earthy,None,4,6,2,19.5678,0,0,0,Flower Lot,1,809,146,200,1,0.98,0.02,0,0.98
46225,Ortega,Hybrid,Depression, Pain,None,None,None,Relaxed, Uplifted, Euphoric, Sleepy, Dry Mouth,None,None,None,Pepper, Earthy,None,2,5,2,17.2753,0.1,172.75,0.01,Flower Lot,1,0,0,0,0,0,0,0,0
46391,Blockhead,Hybrid,None,None,None,None,None,Relaxed,Happy,Hungry,Uplifted,Euphoric,None,None,None,None,None,None,0,5,0,20.3,0.18,112.78,0.01,Flower Lot,1,907,151,49,1,1,0,0,1
46491,Amethyst,Hybrid,None,None,None,None,None,Energetic,Creative,Giggly,Hungry,Happy,None,None,None,None,None,None,0,5,0,17.39,0.14,124.21,0.01,Flower Lot,1,1335,152,26,1,1,0,0,1
