test_id,test_strain,type,ailment_1,ailment_2,ailment_3,ailment_4,ailment_5,effects_1,effects_2,effects_3,effects_4,effects_5,effects_6,effects_7,effects_8,flavor_1,flavor_2,flavor_3,ailment_count,effects_count,flavor_count,thc_max,cbd_max,thc_cbd,cbd_thc,inventory_type,chemotype,strain_leafly_page_rank,strain_leafly_review_rank,strain_tests,strain_chemotype,strain_prop_chemotype1,strain_prop_chemotype2,strain_prop_chemotype3,strain_modal_chemo_prop
6856,Sweet and Sour Widow,Indica,Pain, Stress, Depression, Insomnia,None,Relaxed, Happy, Uplifted, Euphoric, Tingly, Dry Mouth, Paranoid,None,Earthy, Sweet,None,4,7,2,6.45328,0,0,0,Flower Lot,1,573,150,132,2,0.1666667,0.8333333,0,0.8333333
6866,Early Girl,Indica,Stress, Pain, Depression, Muscle Spasms, Lack of Appetite,Relaxed, Happy, Uplifted, Euphoric, Hungry, Dry Mouth, Anxious, Paranoid,Citrus, Earthy, Sweet,5,8,3,18.0007,0,0,0,Flower Lot,1,757,150,14,1,1,0,0,1
6875,Nuken,Hybrid,Depression, Lack of Appetite, Pain,None,None,Relaxed, Happy, Euphoric, Uplifted, Dry Mouth, Paranoid,None,None,Citrus, Earthy,None,3,6,2,16.47958,0,0,0,Flower Lot,1,283,118,103,1,0.9902912,0.0097087,0,0.9902912
6939,Kilimanjaro,Sativa,Depression, Stress, Pain, Muscle Spasms,None,Energetic, Happy, Talkative, Creative, Uplifted, Dry Mouth, Paranoid, Anxious,Earthy, Pine,None,4,8,2,14.06845,0,0,0,Flower Lot,1,858,137,1,1,1,0,0,1
6941,Wild Thailand,Hybrid,Depression, Pain, Stress,None,None,Horny, Euphoric, Talkative, Creative, Energetic, Dry Mouth, Anxious,None,Sweet, Berry,None,3,7,2,13.1062,0,0,0,Flower Lot,1,1459,151,43,1,0.9534883,0.0465116,0,0.9534883
6999,Great White Shark,Sativa,Stress, Pain, Depression,None,None,Relaxed, Happy, Uplifted, Euphoric, Energetic, Dry Mouth, Anxious,None,Earthy, Citrus,None,3,7,2,10.15345,0.531,19.12,0.05,Flower Lot,1,159,103,210,1,0.9809524,0.0190476,0,0.9809524
7004,Haze Mist,Hybrid,Nausea, Stress,None,None,None,Energetic, Focused, Happy, Hungry,None,None,None,None,None,None,None,2,4,0,6.262763,0.65,9.64,0.1,Flower Lot,1,1636,152,1,1,1,0,0,1
7019,Kalashnikova,Hybrid,None,None,None,None,None,Relaxed,Happy,Energetic,Hungry,Sleepy,None,None,None,None,None,None,0,5,0,8.677074,0.235,36.92,0.03,Flower Lot,1,840,143,3,1,1,0,0,1
7036,Super Critical,Hybrid,None,None,None,None,None,None,None,None,None,None,None,None,None,Sage,Pungent,Diesel,0,0,3,12.33255,0.926,13.32,0.08,Flower Lot,1,0,0,0,0,0,0,0,0
7052,The Doctor,Hybrid,Insomnia, Pain, Stress, Inflammation, Depression,Relaxed, Euphoric, Happy, Sleepy, Dry Mouth, Anxious,None,None,Earthy, Citrus,None,5,6,2,13.15114,0.346,38.01,0.03,Flower Lot,1,768,148,6,1,1,0,0,1
7409,Jamaican Lion,Hybrid,Pain, Stress, Muscle Spasms, Depression,None,Uplifted, Relaxed, Happy, Energetic, Talkative, Dry Mouth, Paranoid,None,Earthy, Lime,None,4,7,2,23.8913,0.8,29.86,0.03,Flower Lot,1,811,148,22,2,0.3181818,0.6818182,0,0.6818182
7416,Jedi Kush,Hybrid,Stress, Pain, Depression, Insomnia,None,Relaxed, Euphoric, Happy, Uplifted, Sleepy, Dry Mouth, Anxious,None,Earthy, Sweet,None,4,7,2,16.032,0,0,0,Flower Lot,1,251,110,94,1,1,0,0,1
7428,Redwood Kush,Hybrid,Insomnia, Pain, Stress, Depression, Muscle Spasms,Euphoric, Relaxed, Uplifted, Happy, Focused, Dry Mouth, Paranoid,None,Pine, Earthy,None,5,7,2,11.19282,0.14,79.95,0.01,Flower Lot,1,505,135,5,1,1,0,0,1
7454,Jesus OG,Hybrid,Stress, Depression, Pain,None,None,Happy, Euphoric, Uplifted, Focused, Creative, Dry Mouth, Anxious, Paranoid,Earthy, Citrus, Lemon,3,8,3,18.54,1,18.54,0.05,Flower Lot,1,188,108,636,1,1,0,0,1
7457,ACDC,Sativa,None,None,None,None,None,Relaxed,Happy,Uplifted,Focused,Euphoric,None,None,None,None,None,None,0,5,0,4.50607,9.03,0.5,2,Flower Lot,2,77,62,1126,3,0.0586146,0.312611,0.6287744,0.6287744
7474,Orange Creamsicle,Hybrid,None,None,None,None,None,None,None,None,None,None,None,None,None,Diesel,Earthy,Pungent,0,0,3,16.14124,0.15,107.61,0.01,Flower Lot,1,408,129,72,1,1,0,0,1
7475,Original Blueberry,Hybrid,None,None,None,None,None,None,None,None,None,None,None,None,None,Earthy,Sweet,Flowery,0,0,3,14.132,0,0,0,Flower Lot,1,0,0,0,0,0,0,0,0
7514,Shark Shock,Hybrid,Pain, Stress, Inflammation, Depression, Muscle Spasms,Relaxed, Euphoric, Focused, Happy, Sleepy, Dry Mouth, Anxious,None,Earthy, Sweet,None,5,7,2,3.91142,0.18,21.73,0.05,Flower Lot,1,382,137,140,1,0.5714286,0.4285714,0,0.5714286
7515,SnowLAnd,Hybrid,None,None,None,None,None,Relaxed,Sleepy,Talkative,Creative,Focused,None,None,None,None,None,None,0,5,0,14.37997,0,0,0,Flower Lot,1,861,150,161,1,1,0,0,1
7785,Humboldt,Hybrid,None,None,None,None,None,Relaxed,Sleepy,Euphoric,Happy,Uplifted,None,None,None,Diesel,Flowery,Earthy,0,5,3,12.79479,0,0,0,Flower Lot,1,609,116,38,1,1,0,0,1
7821,Grapefruit,Hybrid,Stress, Depression, Pain,None,None,Happy, Energetic, Euphoric, Relaxed, Uplifted, Dry Mouth, Paranoid,None,Citrus, Sweet,None,3,7,2,21.01425,0.74,28.4,0.04,Flower Lot,1,154,89,600,1,0.9966667,0.0033333,0,0.9966667
7824,NightFire OG,Hybrid,Stress, Depression,None,None,None,Talkative, Energetic, Happy, Euphoric, Creative, Dry Mouth, Anxious,None,Earthy, Citrus,None,2,7,2,20.31682,0.794,25.59,0.04,Flower Lot,1,1302,151,119,1,1,0,0,1
7855,Fucking Incredible,Hybrid,Pain, Stress, Depression, Insomnia,None,Relaxed, Euphoric, Happy, Uplifted, Dry Mouth, Paranoid, Anxious,None,Skunk, Earthy,None,4,7,2,18.59481,0.23,80.85,0.01,Flower Lot,1,351,106,484,1,0.9504132,0.0495868,0,0.9504132
7892,Afghan Skunk,Hybrid,Stress, Insomnia, Depression, Nausea, Muscle Spasms,Relaxed, Happy, Sleepy, Uplifted, Creative, Dry Mouth, Anxious,None,Earthy,None,None,5,7,1,23.14938,0.26,89.04,0.01,Flower Lot,1,725,146,17,1,1,0,0,1
7911,Monster Cookies,Hybrid,Stress, Pain, Insomnia, Depression,None,Relaxed, Happy, Euphoric, Sleepy, Uplifted, Dry Mouth, Paranoid,None,Earthy, Grape, Sweet,4,7,3,17.42981,0.296,58.88,0.02,Flower Lot,1,217,101,34,1,1,0,0,1
7955,Green Dragon,Hybrid,Pain, Stress, Nausea, Depression,None,Relaxed, Euphoric, Uplifted, Sleepy, Happy, Dry Mouth, Paranoid, Anxious,Sweet, Earthy,None,4,8,2,19.00591,0.689,27.58,0.04,Flower Lot,1,520,140,22,1,1,0,0,1
8022,Purple Bubba,Indica,Lack of Appetite, Muscle Spasms, Inflammation, Pain, Stress,Relaxed, Sleepy, Hungry, Happy, Tingly, Dry Mouth,None,None,Grape, Berry, Sweet,5,6,3,23.048,0,0,0,Flower Lot,1,579,149,17,1,0.8823529,0.1176471,0,0.8823529
8085,Tropicali,Hybrid,None,None,None,None,None,Euphoric,Uplifted,Relaxed,Energetic,Happy,None,None,None,None,None,None,0,5,0,18.6808,0.24,77.84,0.01,Flower Lot,1,1229,151,19,1,1,0,0,1
8151,Huckleberry,Hybrid,None,None,None,None,None,Happy,Relaxed,Talkative,Uplifted,Euphoric,None,None,None,None,None,None,0,5,0,19.3,0.2,96.5,0.01,Flower Lot,1,409,128,98,1,0.9081632,0.0714286,0.0204082,0.9081632
8349,Yummy,Hybrid,None,None,None,None,None,Uplifted,Relaxed,Happy,Energetic,Euphoric,None,None,None,None,None,None,0,5,0,3.64185,0.21,17.34,0.06,Flower Lot,1,1143,151,85,3,0.0117647,0.1764706,0.8117647,0.8117647
8363,Pineapple Euphoria,Hybrid,None,None,None,None,None,None,None,None,None,None,None,None,None,Skunk,Pungent,Earthy,0,0,3,17.8069,0.2,89.03,0.01,Flower Lot,1,0,0,0,0,0,0,0,0
8597,Chronic Thunder,Indica,Insomnia, Pain, Muscle Spasms, Stress, Lack of Appetite,Relaxed, Happy, Sleepy, Euphoric, Hungry, Dry Mouth, Paranoid, Anxious,Earthy,None,None,5,8,1,13.5796,0.36,37.72,0.03,Flower Lot,1,726,140,11,1,1,0,0,1
8766,Jacky White,Hybrid,Stress, Nausea, Depression, Pain,None,Energetic, Relaxed, Happy, Focused, Euphoric, Dry Mouth, Anxious, Paranoid,Citrus,None,None,4,8,1,17.0876,1.9,8.99,0.11,Flower Lot,1,723,141,80,1,1,0,0,1
8773,Hawaiian,Hybrid,Stress, Depression, Pain, Lack of Appetite, Nausea,Happy, Uplifted, Relaxed, Creative, Talkative, Dry Mouth, Paranoid, Anxious,Sweet, Citrus,None,5,8,2,13.6,0,0,0,Flower Lot,1,204,139,183,1,0.9234973,0.0765027,0,0.9234973
8873,Emerald Jack,Hybrid,Stress, Depression, Pain, Insomnia,None,Happy, Uplifted, Creative, Horny, Euphoric, Dry Mouth, Anxious, Paranoid,Pine, Earthy, Citrus,4,8,3,17.663,1,17.66,0.06,Flower Lot,1,960,142,98,1,1,0,0,1
8966,K2,Hybrid,None,None,None,None,None,Relaxed,Happy,Giggly,Hungry,Sleepy,None,None,None,None,None,None,0,5,0,21.02989,0,0,0,Flower Lot,1,624,146,4,1,1,0,0,1
8985,Cannalope Kush,Hybrid,None,None,None,None,None,None,None,None,None,None,None,None,None,Citrus,Lime,Lemon,0,0,3,10.0216,0.2,50.11,0.02,Flower Lot,1,527,142,699,1,1,0,0,1
8991,Lemon Sour Diesel,Hybrid,None,None,None,None,None,None,None,None,None,None,None,None,None,Vanilla,Sweet,Coffee,0,0,3,12.91126,0.1,129.11,0.01,Flower Lot,1,124,83,236,1,0.9830508,0.0169492,0,0.9830508
9028,Apple Jack,Hybrid,None,None,None,None,None,None,None,None,None,None,None,None,None,Earthy,Pungent,Citrus,0,0,3,24.55675,0.5,49.11,0.02,Flower Lot,1,481,136,89,1,1,0,0,1
9048,Northern Berry,Hybrid,Stress, Pain, Insomnia, Depression, Inflammation,Relaxed, Sleepy, Happy, Euphoric, Tingly, Dry Mouth, Paranoid,None,Berry, Sweet, Earthy,5,7,3,13.4257,0.13,103.27,0.01,Flower Lot,1,789,145,9,1,1,0,0,1
9187,Northern Lights #5,Hybrid,Pain, Stress, Insomnia, Inflammation, Nausea,Relaxed, Euphoric, Happy, Focused, Uplifted, Dry Mouth, Paranoid,None,Sweet, Pine, Citrus,5,7,3,16.8,0,0,0,Flower Lot,1,310,135,187,1,1,0,0,1
9228,Medusa,Hybrid,None,None,None,None,None,Relaxed,Happy,Euphoric,Creative,Uplifted,None,None,None,None,None,None,0,5,0,15.24991,0.09,169.44,0.01,Flower Lot,1,774,143,101,1,0.990099,0.009901,0,0.990099
9237,Black Russian,Hybrid,Stress, Insomnia, Lack of Appetite, Nausea,None,Relaxed, Euphoric, Uplifted, Happy, Sleepy, Dry Mouth, Paranoid,None,Citrus, Earthy, Lemon,4,7,3,13.7158,0.2,68.58,0.01,Flower Lot,1,611,136,207,1,1,0,0,1
9494,Golden Pineapple,Hybrid,None,None,None,None,None,None,None,None,None,None,None,None,None,Woody,Spicy/Herbal,Sweet,0,0,3,23.2651,0.4,58.16,0.02,Flower Lot,1,278,107,1648,1,0.9987864,0.0012136,0,0.9987864
9532,9 Pound Hammer,Hybrid,Stress, Pain, Insomnia, Depression, Muscle Spasms,Relaxed, Sleepy, Happy, Euphoric, Hungry, Dry Mouth, Anxious,None,Earthy, Sweet, Berry,5,7,3,19.30561,0.21,91.93,0.01,Flower Lot,1,106,54,1069,1,0.9953227,0.0046773,0,0.9953227
9751,Jazz,Hybrid,None,None,None,None,None,Uplifted,Relaxed,Euphoric,Energetic,Happy,None,None,None,None,None,None,0,5,0,9.387722,0,0,0,Flower Lot,1,1301,146,11,1,1,0,0,1
9759,Blue Lights,Indica,Stress, Depression, Insomnia, Nausea, Pain,Euphoric, Relaxed, Energetic, Talkative, Dry Mouth, Paranoid,None,None,Blueberry, Sweet,None,5,6,2,15.3721,0.2,76.86,0.01,Flower Lot,1,831,150,2,1,1,0,0,1
9774,Frankenstein,Hybrid,Stress, Insomnia, Pain, Depression, Lack of Appetite,Relaxed, Sleepy, Creative, Tingly, Focused, Dry Mouth, Anxious,None,Earthy, Skunk,None,5,7,2,14.74181,0,0,0,Flower Lot,1,1056,150,104,1,1,0,0,1
9880,Supernatural,Hybrid,Stress, Lack of Appetite,None,None,None,Euphoric, Relaxed, Happy, Energetic, Horny, Dry Mouth,None,None,Citrus, Earthy,None,2,6,2,18.0746,0.19,95.13,0.01,Flower Lot,1,1495,151,126,1,1,0,0,1
9894,Canna-Tsu,Hybrid,None,None,None,None,None,Relaxed,Happy,Focused,Uplifted,Creative,None,None,None,None,None,None,0,5,0,3.58538,11.9,0.3,3.32,Flower Lot,2,377,130,41,2,0.0731707,0.6585366,0.2682927,0.6585366
9901,Platinum Bubba Kush,Indica,Pain, Stress, Insomnia, Depression, Inflammation,Relaxed, Happy, Euphoric, Sleepy, Uplifted, Dry Mouth, Paranoid,None,Earthy,None,None,5,7,1,8.04006,0.12,67,0.01,Flower Lot,1,162,103,109,1,1,0,0,1
9905,Swiss Gold,Hybrid,Pain, Stress, Depression, Inflammation,None,Relaxed, Happy, Focused, Uplifted, Hungry, Dry Mouth, Paranoid, Anxious,Citrus, Berry,None,4,8,2,2.44218,4.11,0.59,1.68,Flower Lot,2,1183,152,10,2,0,1,0,1
9954,Blue Power,Hybrid,Stress, Insomnia, Depression, Lack of Appetite, Nausea,Relaxed, Happy, Sleepy, Hungry, Uplifted, Dry Mouth, Paranoid,None,Berry, Earthy,None,5,7,2,19.24,0.34,56.59,0.02,Flower Lot,1,594,142,117,1,1,0,0,1
9990,Jillybean,Hybrid,None,None,None,None,None,Happy,Uplifted,Euphoric,Relaxed,Creative,None,None,None,None,None,None,0,5,0,17.786,0,0,0,Flower Lot,1,116,68,571,1,1,0,0,1
10502,Power Plant,Hybrid,Pain, Stress, Depression, Inflammation,None,Happy, Uplifted, Relaxed, Euphoric, Energetic, Dry Mouth, Paranoid,None,Earthy,None,None,4,7,1,16.3637,0.29,56.43,0.02,Flower Lot,1,166,115,10,1,1,0,0,1
10503,Opium,Hybrid,None,None,None,None,None,Happy,Relaxed,Euphoric,Uplifted,Giggly,None,None,None,None,None,None,0,5,0,13.56901,0,0,0,Flower Lot,1,1179,149,3,1,1,0,0,1
10504,Skunk 47,Indica,Pain, Depression, Stress, Nausea,None,Relaxed, Happy, Uplifted, Euphoric, Sleepy, Dry Mouth,None,None,Earthy, Skunk,None,4,6,2,20.0202,0.33,60.67,0.02,Flower Lot,1,1322,150,230,1,1,0,0,1
10527,C4,Hybrid,None,None,None,None,None,Relaxed,Happy,Euphoric,Creative,Uplifted,None,None,None,None,None,None,0,5,0,22.048,0,0,0,Flower Lot,1,509,148,6,1,1,0,0,1
10764,NYPD,Sativa,Stress, Depression, Pain,None,None,Uplifted, Relaxed, Happy, Energetic, Euphoric, Anxious, Dry Mouth, Paranoid,Earthy,None,None,3,8,1,17.8015,0.1,178.02,0.01,Flower Lot,1,826,147,105,1,1,0,0,1
10983,QuickSilver,Hybrid,None,None,None,None,None,None,None,None,None,None,None,None,None,Earthy,Pungent,Citrus,0,0,3,15.3721,0.6,25.62,0.04,Flower Lot,1,0,0,0,0,0,0,0,0
10997,Space Jill,Sativa,Pain, Stress, Depression, Nausea,None,Creative, Focused, Energetic, Uplifted, Euphoric, Dry Mouth, Paranoid,None,None,None,None,4,7,0,16.909,0,0,0,Flower Lot,1,1675,152,12,1,1,0,0,1
11047,White Kush,Hybrid,Insomnia, Pain, Stress, Depression, Lack of Appetite,Sleepy, Relaxed, Hungry, Horny, Happy, Dry Mouth, Paranoid, Anxious,Berry, Sweet,None,5,8,2,26.0961,0.8,32.62,0.03,Flower Lot,1,634,145,5,1,1,0,0,1
11111,Goo,Hybrid,Pain, Stress, Insomnia, Lack of Appetite, Muscle Spasms,Sleepy, Relaxed, Hungry, Euphoric, Happy, Dry Mouth, Paranoid,None,Berry, Sweet, Blueberry,5,7,3,17.663,0.2,88.32,0.01,Flower Lot,1,374,140,46,1,0.9782609,0.0217391,0,0.9782609
11113,Chemo,Hybrid,Insomnia, Pain, Stress, Lack of Appetite, Depression,Relaxed, Sleepy, Happy, Hungry, Euphoric, Dry Mouth, Paranoid,None,Earthy, Sweet,None,5,7,2,14.6197,0.3,48.73,0.02,Flower Lot,1,243,95,31,1,1,0,0,1
11118,True OG,Indica,Stress, Insomnia, Pain, Depression,None,Relaxed, Euphoric, Sleepy, Happy, Focused, Dry Mouth, Anxious,None,Earthy, Pine,None,4,7,2,23.869,0.17,140.41,0.01,Flower Lot,1,131,102,107,1,0.9813084,0.0186916,0,0.9813084
11209,Deep Sleep,Indica,Pain, Insomnia, Depression, Lack of Appetite, Nausea,Relaxed, Sleepy, Euphoric, Happy, Tingly, Dry Mouth, Anxious,None,Earthy, Sweet, Pine,5,7,3,25.33722,0,0,0,Flower Lot,1,816,138,9,1,1,0,0,1
11633,Matanuska Thunder,Hybrid,None,None,None,None,None,None,None,None,None,None,None,None,None,Sweet,Blueberry,Berry,0,0,3,15.9013,0.19,83.69,0.01,Flower Lot,1,329,133,71,1,1,0,0,1
11644,Hawaiian Delight,Indica,Pain, Stress, Nausea, Depression,None,Happy, Relaxed, Horny, Uplifted, Euphoric, Dry Mouth, Paranoid,None,Sweet,None,None,4,7,1,19.4432,0.9,21.6,0.05,Flower Lot,1,0,0,0,0,0,0,0,0
11656,Purple Nepal,Hybrid,Stress, Insomnia, Pain, Depression,None,Relaxed, Sleepy, Happy, Euphoric, Uplifted, Dry Mouth, Paranoid,None,Grape, Berry,None,4,7,2,19.38698,0,0,0,Flower Lot,1,949,148,55,1,1,0,0,1
11745,Dream Berry,Hybrid,Pain, Depression, Stress, Insomnia, Lack of Appetite,Relaxed, Sleepy, Euphoric, Happy, Dry Mouth,None,None,None,Berry, Citrus,None,5,5,2,14.3,0,0,0,Flower Lot,1,1165,152,20,1,0.9,0.1,0,0.9
11770,Gorilla Glue,Hybrid,None,None,None,None,None,None,None,None,None,None,None,None,None,Berry,Sweet,Earthy,0,0,3,18.1477,0.19,95.51,0.01,Flower Lot,1,15,33,1603,1,0.9943855,0.0056145,0,0.9943855
11786,Blue Moonshine,Hybrid,Stress, Pain, Depression, Insomnia, Lack of Appetite,Relaxed, Happy, Euphoric, Uplifted, Energetic, Dry Mouth, Paranoid,None,Berry, Earthy, Pine,5,7,3,13.5919,1.1,12.36,0.08,Flower Lot,1,626,146,27,1,1,0,0,1
11867,EWOK,Hybrid,None,None,None,None,None,Relaxed,Happy,Euphoric,Creative,Uplifted,None,None,None,None,None,None,0,5,0,18.9431,0,0,0,Flower Lot,1,566,128,895,1,0.9932961,0.0044693,0.0022346,0.9932961
11884,Bay Dream,Hybrid,Depression, Stress, Lack of Appetite, Pain,None,Happy, Euphoric, Hungry, Uplifted, Focused, Dry Mouth, Paranoid, Anxious,Citrus,None,None,4,8,1,19.0232,0.17,111.9,0.01,Flower Lot,1,617,142,553,1,0.9349005,0.0271248,0.0379747,0.9349005
11886,Hawaiian Dream,Sativa,Depression, Pain, Inflammation, Stress,None,Happy, Relaxed, Focused, Euphoric, Energetic, Dry Mouth, Anxious, Paranoid,Sweet, Pineapple,None,4,8,2,19.70849,0.17,115.93,0.01,Flower Lot,1,526,136,110,2,0.1454545,0.8545455,0,0.8545455
11896,Presidential OG,Hybrid,Insomnia, Stress, Pain, Lack of Appetite, Depression,Relaxed, Sleepy, Happy, Euphoric, Hungry, Dry Mouth, Anxious,None,Earthy, Pine,None,5,7,2,14.59804,0.17,85.87,0.01,Flower Lot,1,207,97,1744,1,1,0,0,1
11964,Grape Skunk,Hybrid,Nausea, Stress, Pain, Depression, Insomnia,Happy, Uplifted, Talkative, Energetic, Relaxed, Dry Mouth,None,None,Skunk, Earthy, Grape,5,6,3,18.8039,0.19,98.97,0.01,Flower Lot,1,1181,150,52,1,1,0,0,1
12031,Laughing Buddha,Sativa,Depression, Stress, Pain, Lack of Appetite,None,Happy, Euphoric, Uplifted, Energetic, Dry Mouth, Paranoid, Anxious,None,Citrus, Sweet,None,4,7,2,22.60591,0,0,0,Flower Lot,1,224,123,76,1,1,0,0,1
12090,MILF,Hybrid,None,None,None,None,None,Happy,Euphoric,Uplifted,Giggly,Relaxed,None,None,None,None,None,None,0,5,0,16.28231,0.16,101.76,0.01,Flower Lot,1,667,152,33,1,1,0,0,1
12284,Northern Wreck,Hybrid,Depression, Stress, Pain, Nausea,None,Euphoric, Happy, Relaxed, Creative, Uplifted, Dry Mouth, Paranoid, Anxious,Earthy, Pine,None,4,8,2,19.5,0.2,97.5,0.01,Flower Lot,1,1043,144,6,1,1,0,0,1
12426,Blue Dynamite,Hybrid,Pain, Stress, Insomnia, Depression, Lack of Appetite,Relaxed, Sleepy, Happy, Euphoric, Hungry, Dry Mouth, Paranoid,None,Citrus, Lemon, Earthy,5,7,3,4.508,12,0.38,2.66,Flower Lot,2,962,150,48,2,0.1458333,0.6666667,0.1875,0.6666667
12611,Guard Dawg,Hybrid,Muscle Spasms,None,None,None,None,Euphoric, Happy, Relaxed,None,None,None,None,None,Sweet, Earthy,None,1,3,2,65.75629,1.18,55.73,0.02,CO2 Hash Oil,1,1733,150,2,1,1,0,0,1
12637,Cotton Candy Kush,Hybrid,None,None,None,None,None,None,None,None,None,None,None,None,None,Sweet,Earthy,Flowery,0,0,3,18.8916,0.48,39.36,0.03,Flower Lot,1,94,63,925,1,0.9902703,0.0010811,0.0086486,0.9902703
12641,Tutankhamon,Sativa,Depression, Stress, Nausea, Pain, Insomnia,Uplifted, Focused, Happy, Energetic, Euphoric, Dry Mouth, Anxious, Paranoid,Skunk,None,None,5,8,1,88.42986,2.64,33.5,0.03,CO2 Hash Oil,1,206,108,98,1,1,0,0,1
12827,Champagne,Hybrid,None,None,None,None,None,None,None,None,None,None,None,None,None,Cheese,Earthy,Pungent,0,0,3,12.6887,0.13,97.61,0.01,Flower Lot,1,0,0,0,0,0,0,0,0
12836,Blue Afghani,Hybrid,Lack of Appetite, Stress, Insomnia, Depression,None,Relaxed, Euphoric, Hungry, Creative, Happy, Dry Mouth, Paranoid,None,Blueberry,None,None,4,7,1,26.556,0,0,0,Flower Lot,1,950,146,68,1,1,0,0,1
12997,Lavender Haze,Sativa,Stress, Depression, Pain, Inflammation, Lack of Appetite,Happy, Focused, Relaxed, Euphoric, Uplifted, Dry Mouth, Anxious, Paranoid,Lavender, Earthy,None,5,8,2,25.556,0,0,0,Flower Lot,1,1257,146,9,1,1,0,0,1
13108,Aliens On Moonshine,Indica,Inflammation, Stress,None,None,None,Relaxed, Happy, Tingly, Focused,None,None,None,None,Vanilla,None,None,2,4,1,17.155,0,0,0,Flower Lot,1,911,143,260,2,0.1076923,0.8923077,0,0.8923077
13369,Snowcap,Hybrid,None,None,None,None,None,Happy,Euphoric,Uplifted,Focused,Creative,None,None,None,None,None,None,0,5,0,20.7,0.1,207,0,Flower Lot,1,191,108,88,1,0.9886364,0.0113636,0,0.9886364
13404,Flowerbomb Kush,Hybrid,Stress, Pain, Lack of Appetite, Muscle Spasms,None,Relaxed, Hungry, Sleepy, Tingly, Happy, Dry Mouth, Anxious, Paranoid,Earthy, Citrus,None,4,8,2,16.6222,0.13,127.86,0.01,Flower Lot,1,775,148,16,1,1,0,0,1
13525,Blue Knight,Indica,Stress, Pain, Depression, Lack of Appetite,None,Relaxed, Uplifted, Happy, Sleepy, Euphoric, Dry Mouth, Paranoid, Anxious,Berry, Sweet, Blueberry,4,8,3,16.5,0.3,55,0.02,Flower Lot,1,507,142,27,1,1,0,0,1
13531,Super Silver Sour Diesel Haze,Hybrid,None,None,None,None,None,None,None,None,None,None,None,None,None,Cheese,Pepper,Tea,0,0,3,15.6452,0.37,42.28,0.02,Flower Lot,1,0,0,0,0,0,0,0,0
13701,Platinum Kush,Hybrid,Stress, Insomnia, Lack of Appetite, Pain, Depression,Relaxed, Happy, Hungry, Euphoric, Sleepy, Dry Mouth, Paranoid, Anxious,Earthy, Sweet,None,5,8,2,15.7329,0.16,98.33,0.01,Flower Lot,1,72,64,192,1,1,0,0,1
13817,Matanuska Thunder Fuck,Sativa,Depression, Stress, Pain, Inflammation,None,Euphoric, Happy, Relaxed, Creative, Energetic, Dry Mouth, Anxious, Paranoid,Earthy, Pine,None,4,8,2,41.93075,0.26,161.27,0.01,Bubble Hash,1,329,133,71,1,1,0,0,1
13845,Afghani,Indica,Stress, Insomnia, Pain, Lack of Appetite, Depression,Relaxed, Sleepy, Euphoric, Happy, Uplifted, Dry Mouth, Paranoid,None,Earthy, Sweet, Pine,5,7,3,12.8526,0.63,20.4,0.05,Flower Lot,1,83,99,166,1,0.939759,0.060241,0,0.939759
14053,Bubbleberry,Hybrid,None,None,None,None,None,Happy,Relaxed,Focused,Uplifted,Hungry,None,None,None,None,None,None,0,5,0,12.9765,0.06,216.28,0,Flower Lot,1,490,141,221,1,1,0,0,1
14223,Hammerhead,Hybrid,Insomnia, Pain, Stress, Lack of Appetite,None,Sleepy, Horny, Tingly, Relaxed, Euphoric, Dry Mouth,None,None,Berry, Earthy,None,4,6,2,3.14683,6.36,0.49,2.02,Flower Lot,2,824,147,80,1,0.6375,0.3625,0,0.6375
14253,Vader OG,Hybrid,Pain, Stress, Depression, Insomnia,None,Relaxed, Happy, Talkative, Creative, Anxious,None,None,None,Earthy, Sweet,None,4,5,2,19.9063,0.3,66.35,0.02,Flower Lot,1,1119,142,10,1,1,0,0,1
14283,Key Lime Pie,Hybrid,None,None,None,None,None,None,None,None,None,None,None,None,None,Menthol,Spicy/Herbal,Sweet,0,0,3,17.2,0.4,43,0.02,Flower Lot,1,198,120,152,1,1,0,0,1
14472,Blue Alien,Hybrid,Pain, Stress, Insomnia, Inflammation,None,Relaxed, Euphoric, Sleepy, Hungry, Happy, Dry Mouth, Paranoid, Anxious,Blueberry, Grape, Citrus,4,8,3,16.933,0.12,141.11,0.01,Flower Lot,1,830,145,91,1,1,0,0,1
14538,Dark Star,Indica,Pain, Stress, Insomnia, Depression,None,Relaxed, Happy, Sleepy, Euphoric, Uplifted, Dry Mouth, Paranoid, Anxious,Earthy, Pine,None,4,8,2,18.7977,0.22,85.44,0.01,Flower Lot,1,237,115,154,1,1,0,0,1
14714,Strawberry Mango Haze,Sativa,Stress, Depression, Pain,None,None,Happy, Euphoric, Uplifted, Focused, Dry Mouth, Paranoid, Anxious,None,Mango, Strawberry, Sweet,3,7,3,47.9,1.3,36.85,0.03,CO2 Hash Oil,1,666,145,256,1,1,0,0,1
14801,Nordle,Hybrid,Stress, Pain, Depression, Inflammation, Muscle Spasms,Relaxed, Happy, Sleepy, Focused, Dry Mouth, Paranoid, Anxious,None,Pine,None,None,5,7,1,7.90557,11.7,0.68,1.48,Flower Lot,2,920,140,90,2,0.2444444,0.7555556,0,0.7555556
15126,Pineapple Super Silver Haze,Sativa,Stress, Depression, Lack of Appetite, Pain,None,Happy, Uplifted, Euphoric, Creative, Energetic, Dry Mouth, Anxious, Paranoid,Pineapple, Citrus, Sweet,4,8,3,15.89568,0.13,122.27,0.01,Flower Lot,1,1081,144,203,1,1,0,0,1
15206,Trinity,Hybrid,Depression, Pain, Stress, Muscle Spasms,None,Happy, Uplifted, Euphoric, Relaxed, Horny, Dry Mouth, Anxious, Paranoid,Earthy, Skunk,None,4,8,2,18.8,0.2,94,0.01,Flower Lot,1,344,135,159,1,0.9622642,0.0314465,0.0062893,0.9622642
15590,Ancient OG,Hybrid,Stress, Insomnia, Depression, Pain, Lack of Appetite,Relaxed, Sleepy, Euphoric, Happy, Hungry, Dry Mouth, Paranoid,None,Earthy, Pine,None,5,7,2,16.04183,0.18,89.12,0.01,Flower Lot,1,683,139,1,1,1,0,0,1
15780,Shishkaberry,Indica,Stress, Depression, Insomnia, Pain,None,Relaxed, Happy, Uplifted, Euphoric, Sleepy, Dry Mouth, Paranoid,None,Berry, Sweet, Earthy,4,7,3,18.0854,0.18,100.47,0.01,Flower Lot,1,255,118,139,1,1,0,0,1
15792,Purple Pinecone,Hybrid,None,None,None,None,None,Euphoric, Focused, Happy, Relaxed, Uplifted,None,None,None,None,None,None,0,5,0,17,0,0,0,Flower Lot,1,1461,150,33,1,1,0,0,1
15993,Wappa,Hybrid,None,None,None,None,None,Happy,Giggly,Relaxed,Hungry,Uplifted,None,None,None,None,None,None,0,5,0,23.8551,0.22,108.43,0.01,Flower Lot,1,512,134,82,1,1,0,0,1
16381,Purple Dragon,Indica,Stress, Insomnia, Depression, Pain,None,Relaxed, Euphoric, Uplifted, Happy, Dry Mouth, Paranoid, Anxious,None,Grape, Earthy, Sweet,4,7,3,8.71241,0.06,145.21,0.01,Flower Lot,1,483,149,84,1,1,0,0,1
16451,Candyland,Sativa,Stress, Depression, Pain,None,None,Happy, Uplifted, Euphoric, Energetic, Relaxed, Dry Mouth, Anxious,None,Sweet, Earthy,None,3,7,2,24.802,0,0,0,Flower Lot,1,50,38,419,1,0.9880669,0.0119332,0,0.9880669
16453,3X Crazy,Indica,Stress, Insomnia, Pain, Depression, Lack of Appetite,Relaxed, Happy, Uplifted, Euphoric, Creative, Dry Mouth, Anxious, Paranoid,Earthy, Grape, Sweet,5,8,3,16.786,0,0,0,Flower Lot,1,264,137,13,1,1,0,0,1
16543,Mazar Kush,Indica,Pain, Insomnia, Inflammation, Stress, Nausea,Relaxed, Sleepy, Happy, Hungry, Dry Mouth, Anxious,None,None,Earthy,None,None,5,6,1,14.13505,0.12,117.79,0.01,Flower Lot,1,860,141,12,1,1,0,0,1
16594,Bianca,Hybrid,None,None,None,None,None,Relaxed,Sleepy,Euphoric,Focused,Creative,None,None,None,None,None,None,0,5,0,48.73,0.12,406.08,0,Hydrocarbon Wax,1,1366,149,45,1,1,0,0,1
16698,Sin Diesel,Hybrid,None,None,None,None,None,None,None,None,None,None,None,None,None,Cheese,Woody,Pungent,0,0,3,23.96481,0.66,36.31,0.03,Flower Lot,1,1742,150,7,1,1,0,0,1
16819,Ghost OG Moonshine,Indica,Depression, Lack of Appetite, Pain, Stress, Insomnia,Euphoric, Happy, Hungry, Relaxed, Sleepy, Dry Mouth,None,None,Earthy, Skunk,None,5,6,2,20.0509,0.13,154.24,0.01,Flower Lot,1,1465,149,30,1,1,0,0,1
16975,Platinum OG,Indica,Stress, Insomnia, Pain, Depression, Lack of Appetite,Relaxed, Sleepy, Euphoric, Happy, Hungry, Dry Mouth, Paranoid, Anxious,Earthy, Sweet,None,5,8,2,19.5363,0.15,130.24,0.01,Flower Lot,1,71,65,188,1,1,0,0,1
17000,Blue Train,Hybrid,None,None,None,None,None,None,None,None,None,None,None,None,None,Citrus,Earthy,Sweet,0,0,3,6.68103,0.02,334.05,0,Flower Lot,1,753,150,2,1,1,0,0,1
17211,Dancehall,Hybrid,None,None,None,None,None,Happy,Relaxed,Uplifted,Energetic,Creative,None,None,None,None,None,None,0,5,0,0.63743,16.4,0.04,25.73,Flower Lot,3,797,138,59,3,0.0508475,0.2033898,0.7457627,0.7457627
